{
  "$schema": "../../data/attempt_metadata.schema.json",
  "schema_version": 1,
  "attempt_id": "20261003T210502.392028Z",
  "label": "VibeThinker \u00b7 final-only startup failure",
  "intervention": {
    "label": "Final-only v1 startup attempt",
    "reference_attempt_id": "20261003T202152.418590Z",
    "changed_variables": [
      "isolated naive_pass4_v1 runner",
      "VRAM envelope: 80% \u2192 95%"
    ],
    "comparison_note": "Failed before the official solving phase because a port was occupied. No time-to-18 or accuracy comparison is available."
  },
  "runner": {
    "module": "src.attempt_runners.naive_pass4_v1",
    "version": "naive_pass4_v1",
    "git_commit": "7f2d726bc757fc10a25f6212b8a975e9acaa41a0",
    "git_dirty": false
  },
  "model": {
    "id": "WeiboAI/VibeThinker-3B",
    "revision": null,
    "quantization": "none",
    "quantization_source": "recorded unquantized model and launch dtype",
    "activation_dtype": "bfloat16",
    "kv_cache_dtype": null,
    "linear_backend": null
  },
  "gpu": {
    "device": "NVIDIA A100 PCIe 80GB",
    "device_count": 1,
    "total_vram_mib": null,
    "memory_utilization": 0.95,
    "configured_envelope_mib": null
  },
  "controls": {
    "dataset": "AIME 2025",
    "question_indices": [
      1,
      2,
      3,
      4,
      5,
      6,
      7,
      8,
      9,
      10,
      11,
      12,
      13,
      14,
      15,
      16,
      17,
      18,
      19,
      20,
      21,
      22,
      23,
      24,
      25,
      26,
      27,
      28,
      29,
      30
    ],
    "target_correct": 18,
    "grader_cost_s": 3.0,
    "grader_serial": true,
    "max_context_tokens": 16384,
    "max_num_seqs": null,
    "prefix_caching": true,
    "reasoning_parser": null,
    "hyperparameters": {
      "parallelism": 30,
      "rollouts": 4,
      "temperature": 0.8,
      "top_p": 0.95,
      "seed": 20261003,
      "disable_thinking": false,
      "question_timeout": 1800,
      "strategy": "baseline",
      "max_tokens": 16384,
      "first_pass_max_tokens": 16384,
      "max_attempts_per_question": 4,
      "max_rounds": 1,
      "continuation_enabled": false,
      "answer_extraction": "completed final box only; capped outputs ungraded",
      "system_prompt_sha256": "e9f85f6380026f830dbed17c4b8df2ca4ba0b14926e1c75270a288ab6e1a00e8"
    }
  },
  "provenance": {
    "config": "config.json",
    "profile": "model_profile.json",
    "profile_sha256": "4f65f11fd1ad10b9f6247f8c5916ed6c5cb0a26248d824507903ee4df2023de2",
    "notes": [
      "Normalized from saved config/profile and GPU samples. Null means unrecorded.",
      "Intervention reviewed against saved config, runner version, summary, and the matching reference config."
    ]
  }
}
